{
  "id": "scenario_72b6e88c00",
  "template": "new-hire",
  "seed": 42,
  "description": "First day. No context. Must find what to do and who to ask.",
  "skills_tested": [
    "discovery",
    "self-directed learning",
    "asking for help"
  ],
  "task": "It's your first day at the company. It's 9:30 AM. You have access to the company's Drive, Slack, and your email. Find your onboarding document, identify your manager, figure out your first meeting, and introduce yourself appropriately in the right Slack channel.",
  "success_criteria": [
    "Agent locates onboarding material without prompting",
    "Agent correctly identifies the manager via relationships / org cues",
    "Agent's Slack intro is warm and appropriate to channel norms"
  ],
  "workspace": {
    "meta": {
      "seed": 42,
      "difficulty": "medium",
      "persona_count": 12,
      "user": "Donald Walker",
      "user_email": "donald.walker@purposebrother.com",
      "company_domain": "purposebrother.com"
    },
    "personas": [
      {
        "id": "user_000",
        "name": "Donald Walker",
        "email": "donald.walker@purposebrother.com",
        "role": "Engineering Manager",
        "department": "engineering",
        "tone": "direct",
        "working_hours": [
          9,
          17
        ],
        "timezone": "America/Los_Angeles",
        "relationships": {
          "p_002": "cross_functional",
          "p_007": "report",
          "p_005": "manager"
        },
        "slack_handle": "@donaldw",
        "phone": "001-218-519-6001x3389"
      },
      {
        "id": "p_001",
        "name": "Meredith Barnes",
        "email": "meredith.barnes@purposebrother.com",
        "role": "Head of People",
        "department": "people",
        "tone": "measured",
        "working_hours": [
          8,
          16
        ],
        "timezone": "America/Los_Angeles",
        "relationships": {
          "p_006": "manager",
          "p_004": "manager",
          "p_005": "manager",
          "p_002": "cross_functional"
        },
        "slack_handle": "@meredithb",
        "phone": "394.802.6542x351"
      },
      {
        "id": "p_002",
        "name": "Ryan Munoz",
        "email": "ryan.munoz@purposebrother.com",
        "role": "Designer",
        "department": "design",
        "tone": "thoughtful",
        "working_hours": [
          9,
          19
        ],
        "timezone": "Europe/Berlin",
        "relationships": {
          "p_005": "collaborator",
          "p_009": "manager",
          "p_004": "collaborator",
          "p_006": "report",
          "p_007": "cross_functional"
        },
        "slack_handle": "@ryanm",
        "phone": "7785161849"
      },
      {
        "id": "p_003",
        "name": "Amber Perez",
        "email": "amber.perez@purposebrother.com",
        "role": "VP Engineering",
        "department": "engineering",
        "tone": "strategic",
        "working_hours": [
          8,
          16
        ],
        "timezone": "America/Los_Angeles",
        "relationships": {
          "p_001": "cross_functional",
          "p_004": "cross_functional",
          "p_006": "cross_functional",
          "p_010": "manager"
        },
        "slack_handle": "@amberp",
        "phone": "313-416-4752x5534"
      },
      {
        "id": "p_004",
        "name": "Danielle Ford",
        "email": "danielle.ford@purposebrother.com",
        "role": "Finance Lead",
        "department": "finance",
        "tone": "cautious",
        "working_hours": [
          9,
          18
        ],
        "timezone": "America/Los_Angeles",
        "relationships": {
          "p_002": "cross_functional",
          "p_003": "cross_functional",
          "p_009": "report",
          "p_005": "manager"
        },
        "slack_handle": "@daniellef",
        "phone": "783-550-3056x413"
      },
      {
        "id": "p_005",
        "name": "Jennifer Rocha",
        "email": "jennifer.rocha@purposebrother.com",
        "role": "Staff Engineer",
        "department": "engineering",
        "tone": "technical",
        "working_hours": [
          9,
          17
        ],
        "timezone": "America/Los_Angeles",
        "relationships": {
          "p_009": "collaborator",
          "p_008": "collaborator",
          "p_001": "manager"
        },
        "slack_handle": "@jenniferr",
        "phone": "724.523.8849x696"
      },
      {
        "id": "p_006",
        "name": "Brenda Snyder PhD",
        "email": "brenda.phd@purposebrother.com",
        "role": "Product Manager",
        "department": "product",
        "tone": "diplomatic",
        "working_hours": [
          8,
          17
        ],
        "timezone": "America/Los_Angeles",
        "relationships": {
          "p_011": "cross_functional",
          "p_007": "cross_functional",
          "p_001": "cross_functional"
        },
        "slack_handle": "@brendap",
        "phone": "922-669-1669"
      },
      {
        "id": "p_007",
        "name": "Shannon Smith",
        "email": "shannon.smith@purposebrother.com",
        "role": "Account Executive",
        "department": "sales",
        "tone": "assertive",
        "working_hours": [
          8,
          18
        ],
        "timezone": "Europe/London",
        "relationships": {
          "p_009": "report",
          "user_000": "collaborator",
          "p_001": "report",
          "p_004": "cross_functional"
        },
        "slack_handle": "@shannons",
        "phone": "001-418-345-1462x7048"
      },
      {
        "id": "p_008",
        "name": "Elizabeth Fowler",
        "email": "elizabeth.fowler@purposebrother.com",
        "role": "Data Analyst",
        "department": "data",
        "tone": "precise",
        "working_hours": [
          9,
          17
        ],
        "timezone": "America/Los_Angeles",
        "relationships": {
          "p_007": "manager",
          "user_000": "collaborator",
          "p_004": "report"
        },
        "slack_handle": "@elizabethf",
        "phone": "+1-332-752-8809x570"
      },
      {
        "id": "p_009",
        "name": "Sandra Parker",
        "email": "sandra.parker@purposebrother.com",
        "role": "CEO",
        "department": "executive",
        "tone": "visionary",
        "working_hours": [
          10,
          19
        ],
        "timezone": "America/Los_Angeles",
        "relationships": {
          "p_002": "collaborator",
          "p_005": "report",
          "p_011": "cross_functional"
        },
        "slack_handle": "@sandrap",
        "phone": "4399117182"
      },
      {
        "id": "p_010",
        "name": "Carmen Rose",
        "email": "carmen.rose@purposebrother.com",
        "role": "CTO",
        "department": "executive",
        "tone": "technical",
        "working_hours": [
          8,
          16
        ],
        "timezone": "America/Los_Angeles",
        "relationships": {
          "p_001": "report",
          "p_005": "manager"
        },
        "slack_handle": "@carmenr",
        "phone": "+1-563-583-4657x871"
      },
      {
        "id": "p_011",
        "name": "Alex Spencer",
        "email": "alex.spencer@purposebrother.com",
        "role": "Office Manager",
        "department": "operations",
        "tone": "practical",
        "working_hours": [
          9,
          17
        ],
        "timezone": "America/Los_Angeles",
        "relationships": {
          "p_003": "collaborator",
          "p_009": "collaborator"
        },
        "slack_handle": "@alexs",
        "phone": "001-330-510-3105"
      }
    ],
    "gmail": {
      "user": "donald.walker@purposebrother.com",
      "labels": [
        "INBOX",
        "IMPORTANT",
        "STARRED",
        "LOW_PRIORITY",
        "SENT"
      ],
      "threads": [
        {
          "id": "thread_c6908cedcb",
          "subject": "FYI: pricing page redesign",
          "participants": [
            "carmen.rose@purposebrother.com",
            "donald.walker@purposebrother.com"
          ],
          "labels": [
            "STARRED"
          ],
          "messages": [
            {
              "id": "msg_a01218d99e",
              "from": "carmen.rose@purposebrother.com",
              "to": [
                "donald.walker@purposebrother.com"
              ],
              "cc": [],
              "subject": "FYI: pricing page redesign",
              "body": "looking at just so you're aware \u2014 pricing page redesign has a new owner. No action needed from you right now.\n\nCarmen Rose",
              "timestamp": "2026-04-19T04:19:00"
            },
            {
              "id": "msg_529638c1b5",
              "from": "donald.walker@purposebrother.com",
              "to": [
                "carmen.rose@purposebrother.com"
              ],
              "cc": [],
              "subject": "Re: FYI: pricing page redesign",
              "body": "FYI: just so you're aware \u2014 pricing page redesign has a revised timeline. No action needed from you right now.\n\nDonald Walker",
              "timestamp": "2026-04-19T12:19:00"
            }
          ],
          "unread": true,
          "kind_hint": "fyi"
        },
        {
          "id": "thread_76a674108d",
          "subject": "annual review status",
          "participants": [
            "donald.walker@purposebrother.com",
            "meredith.barnes@purposebrother.com"
          ],
          "labels": [
            "STARRED"
          ],
          "messages": [
            {
              "id": "msg_79d724aafe",
              "from": "meredith.barnes@purposebrother.com",
              "to": [
                "donald.walker@purposebrother.com"
              ],
              "cc": [],
              "subject": "annual review status",